Course_Name,Course_Link,Course_Description,Course_Curriculum
Machine Learning Summer Training,/courses/machine-learning-summer-training,"This is the second step of the Machine Learning Summer Training, want to know more click here.","['AI&ML Blackbelt Plus Program (Sponsored)', 'Overview of Machine Learning / Data Science', 'Common Terminology used in Data Science', 'Applications of Data Science', 'Installation steps for Windows', 'Installation steps for Linux', 'Installation steps for Mac', 'Introduction to Python', 'Introduction to Jupyter Notebook', 'Download Python Module Handouts', 'Introduction to Variables', 'Implementing Variables in Python', 'Introduction to Operators', 'Implementing Operators in Python', 'Quiz: Operators', 'Introduction to Conditional Statements', 'Implementing Conditional Statements in Python', 'Quiz: Conditional Statements', 'Introduction to Looping Constructs', 'Implementing Loops in Python', 'Quiz: Loops in Python', 'Break, Continue and Pass Statements', 'Quiz: Break, Continue and Pass Statement', 'Introduction to Data Structures', 'List and Tuple', 'Implementing List in Pyhton', 'Quiz: Lists', 'List - Project in Python', 'Implementing Tuple in Python', 'Quiz: Tuple', 'Introduction to Sets', 'Implementing Sets in Python', 'Quiz: Sets', 'Introduction to Dictionary', 'Implementing Dictionary in Python', 'Quiz: Dictionary', 'Introduction to String Manipulation', 'Quiz: String Manipulation', 'Introduction to Functions', 'Implementing Functions in Python', 'Quiz: Functions in Python', 'Lambda Expression', 'Quiz: Lambda Expressions', 'Recursion', 'Implementing Recursion in Python', 'Quiz: Recursion', 'Introduction to Modules', 'Modules: Intuition', 'Introduction to Packages', 'Standard Libraries in Python', 'User Defined Libraries in Python', 'Quiz:  Modules, Packages and Standard Libraries', 'Handling Text Files in Python', 'Quiz: Handling Text Files', 'Important Libraries for Data Science', 'Quiz: Important Libraries for Data Science', 'Basics of Numpy in Python', 'Basics of Scipy in Python', 'Quiz: Numpy and Scipy', 'Basics of Pandas in Python', 'Quiz: Pandas', 'Basics of Matplotlib in Python', 'Basics of Scikit-Learn in Python', 'Basics of Statsmodels in Python', 'Reading Data in Python', 'Reading CSV files in Python', 'Reading Big CSV Files in Python', 'Quiz: Reading CSV files in Python', 'Reading Excel & Spreadsheet files in Python', 'Quiz: Reading Excel & Spreadsheet files in Python', 'Reading JSON files in Python', 'Quiz: Reading JSON files in Python', 'Subsetting and Modifying Data in Python', 'Overview of Subsetting in Pandas I', 'Overview of Subsetting in Pandas II', 'Subsetting based on Position', 'Subsetting based on Label', 'Subsetting based on Value', 'Quiz: Subsetting Dataframes', 'Modifying data in Pandas', 'Quiz: Modifying Dataframes', 'Preprocessing, Sorting and Aggregating Data', 'Sorting the Dataframe', 'Quiz:  Sorting Dataframes', 'Concatenating Dataframes in Pandas', 'Concept of SQL-Like Joins in Pandas', 'Implementing SQL-Like Joins in Pandas', 'Quiz: Joins in Pandas', 'Aggregating and Summarizing Dataframes', 'Preprocessing Timeseries Data', 'Quiz: Preprocessing Timeseries Data', 'Visualizing Trends & Pattern in Data', 'Basics of Matplotlib', 'Data Visualization with Matplotlib', 'Quiz: Matplotlib', 'Basics of Seaborn', 'Data Visualization with Seaborn', 'Quiz: Seaborn', '6 Steps of Machine Learning Lifecycle', 'Introduction to Predictive Modeling', 'Defining the Problem statement', 'Introduction to Hypothesis Generation', 'Performing Hypothesis generation', 'Quiz - Performing Hypothesis generation', 'List of hypothesis', 'Data Collection/Extraction', 'Quiz - Data Collection/Extraction', 'Introduction to Exploratory Data Analysis & Data Insights', 'Quiz -  Introduction to Exploratory Data Analysis & Data Insights', 'Role of Statistics in EDA', 'Descriptive Statistics', 'Inferential Statistics', 'Quiz - Descriptive and Inferential Statistics', 'Quiz: Build a Benchmark Model - Regression', 'Benchmark Model: Regression Implementation', 'Quiz: Benchmark Model - Regression Implementation', 'Build a Benchmark Model: Classification', 'Quiz: Build a Benchmark Model - Classification', 'Benchmark Model: Classification Implementation', 'Quiz: Benchmark - Classification Implementation', 'Introduction to Evaluation Metrics', 'Quiz: Introduction to Evaluation Metrics', 'Confusion Matrix', 'Quiz: Confusion Matrix', 'Accuracy', 'Quiz: Accuracy', 'Alternatives of Accuracy', 'Quiz: Alternatives of Accuracy', 'Precision and Recall', 'Quiz: Precision and Recall', 'Thresholding', 'Quiz: Thresholding', 'AUC-ROC', 'Quiz: AUC-ROC', 'Log loss', 'Quiz: Log loss', 'Evaluation Metrics for Regression', 'Quiz: Evaluation Metrics for Regression', 'R2 and Adjusted R2', 'Quiz: R2 and Adjusted R2', 'Dealing with Missing Values in the Data', 'Quiz: Dealing with missing values in the data', 'Replacing Missing Values', 'Quiz: Replacing Missing values', 'Imputing Missing Values in data', 'Quiz: Imputing Missing values in data', 'Working with Categorical Variables', 'Quiz: Working with categorical data', 'Working with Outliers', 'Quiz: Working with outliers', 'Preprocessing Data for Model Building', 'Building a kNN model', 'Quiz: Building a kNN model', 'Determining right value of k', 'Quiz: Determining right value of k', 'How to calculate the distance', 'Quiz: How to calculate the distance', 'Issue with distance based algorithms', 'Quiz: Issue with distance based algorithms', 'Introduction to sklearn', 'Implementing k-Nearest Neighbours algorithm', 'Quiz: Implementing k-Nearest Neighbours algorithm', 'Introduction to Overfitting and Underfitting Models', 'Quiz: Introduction to Overfitting and Underfitting Models', 'Visualizing overfitting and underfitting using knn', 'Quiz: Visualizing overfitting and underfitting using knn', 'Selecting the Right Model', 'What is Validation?', 'Quiz: What is Validation', 'Understanding Hold-Out Validation', 'Quiz: Understanding Hold-Out Validation', 'Implementing Hold-Out Validation', 'Quiz: Implementing Hold-Out Validation', 'Understanding k-fold Cross Validation', 'Implementing k-fold Cross Validation', 'Quiz: Understanding k-fold Cross Validation', 'Quiz: Implementing k-fold Cross Validation', 'Bias Variance Tradeoff', 'Quiz: Bias Variance Tradeoff', 'Introduction to Linear Models', 'Quiz: Introduction to linear model', 'Understanding Cost function', 'Quiz: Understanding Cost function', 'Understanding Gradient descent (Intuition)', 'Maths behind gradient descent', 'Convexity of cost function', 'Quiz: Convexity of Cost function', 'Quiz: Gradient Descent', 'Assumptions of Linear Regression', 'Quiz: Assumptions of linear model', 'Implementing Linear Regression', 'Generalized Linear Models', 'Quiz: Generalized Linear Models', 'Introduction to Logistic Regression', 'Quiz: Introduction to logistic regression', 'Quiz: Logistic Regression', 'Odds Ratio', 'Implementing Logistic Regression', 'Multiclass using Logistic Regression', 'Quiz: Multi-Class Logistic Regression', 'Challenges with Linear Regression', 'Quiz: Challenges with Linear regression', 'Introduction to Regularisation', 'Quiz: Introduction to Regularization', 'Implementing Regularisation', 'Coefficient estimate for ridge and lasso (Optional)', 'Predicting whether a customer will churn or not', 'Introduction to Decision Trees', 'Quiz: Introduction to Decision Trees', 'Purity in Decision Trees', 'Quiz: Purity in Decision Trees', 'Terminologies Related to Decision Trees', 'Quiz: Terminologies Related to Decision Trees', 'How to Select the Best Split Point in Decision Trees', 'Quiz: How to Select the Best Split Point in Decision Trees', 'Chi-Square', 'Quiz: Chi-Square', 'Information Gain', 'Quiz: Information Gain', 'Reduction in Variance', 'Quiz: Reduction in Variance', 'Optimizing Performance of Decision Trees', 'Quiz: Optimizing Performance of Decision Trees', 'Decision Tree Implementation', 'Introduction to Feature Engineering', 'Quiz: Introduction to feature engineering', 'Exercise on Feature Engineering', 'Overview of the module', 'Feature Transformation', 'Quiz: Feature Transformation', 'Feature Scaling', 'Quiz: Feature Scaling', 'Feature Encoding', 'Quiz: Feature Encoding', 'Combining Sparse classes', 'Quiz: Combining Sparse classes', 'Feature Generation: Binning', 'Quiz: Feature Generation- Binning', 'Feature Interaction', 'Quiz: Feature Interaction', 'Generating Features: Missing Values', 'Frequency Encoding', 'Quiz: Frequency Encoding', 'Feature Engineering: Date Time Features', 'Implementing DateTime Features', 'Quiz: Implementing DateTime Features', 'Automated Feature Engineering : Feature Tools', 'Implementing Feature tools', 'Quiz: Implementing Feature Tools', 'Exploring the NYC dataset', 'Predicting the NYC taxi trip duration', 'Predicting the NYC taxi trip duration', 'Share Your Feedback about the course.', 'Would  you recommend this course to your Friends.']"
A Comprehensive Learning Path to Become a Data Engineer in 2022,/courses/a-comprehensive-learning-path-to-become-a-data-engineer-in-2022,"Where do I begin? Data Engineering is such a huge field - where do you even start learning about Data Engineering?
These are career-defining questions often asked by data engineering aspirants. There are a million resources out there to refer but the learning journey can be quite exhausting if you don’t know where to start.
Don’t worry, we are here to help you take your first steps into the world of data engineering! Here’s the learning path for people who want to become a data engineer in 2022. We have arranged and compiled all the best resources in a structured manner so that you have a unified resource to become a successful data engineer.
Moreover, we have added the most in-demand skills for the year 2022 for data engineers including storytelling, model deployment, and much more along with exercises and assignments.","['Overview of Learning Path', 'Month-on-Month Plan', 'AI&ML Blackbelt Plus Program (Sponsored)', 'Overview of the Course', 'A brief introduction to Python', 'Introduction to Python Test', 'Installing Python', 'Become a BlackBelt in Data Science', 'Theory of Operators', 'Exercise', 'Understanding Operators in Python', 'Operators Test', 'Understanding variables and data types', 'Variable Test', 'Variables and Data Types in Python', 'Exercise', 'Understanding Conditional Statements', 'Exercise', 'Implementing Conditional Statements in Python', 'Conditional Statements test', 'Understanding Looping Constructs', 'Exercise', 'Implementing Looping Constructs in Python', 'Looping Constructs test', 'Understanding Functions', 'Implementing Functions in Python', 'Functions test', 'A brief introduction to data structure', 'Data Structure test', 'Understanding the concept of Lists', 'Lists test', 'Implementing Lists in Python', 'Exercise', 'Understanding the concept of Dictionaries', 'Exercise', 'Implementing Dictionaries in Python', 'Dictionaries test', 'Understanding the concept of Standard Libraries', 'Libraries test', 'Reading a CSV File in Python - Introduction to Pandas', 'Reading a CSV file in Python: Implementation', 'Reading a csv file in Python test', 'Understanding dataframes and basic operations', 'DataFrames and basic operations test', 'Reading dataframes and conduct basic operations in Python', 'Reading dataframes and conduct basic operations in Python Test', 'Indexing a Dataframe', 'Indexing DataFrames test', 'Exercise', 'Sorting Dataframes', 'Merging Dataframes', 'Quiz: Sorting and Merging dataframes', 'Apply function', 'Aggregating data', 'Quiz: Apply function and Aggregating data', 'Basics of Matplotlib', 'Data Visualization using Matplotlib', 'Quiz: Matplotlib', 'Basics of Seaborn', 'Data Visualization using Seaborn', 'Quiz: Seaborn', 'Regular Expressions', 'Understanding Regular Expressions', 'Quiz: Regular Expressions', 'Regular Expressions in  Python', 'Quiz: Regular Expressions in Python', 'Cheatsheet for Python', 'Instructions', 'Quiz', 'Python Coding Challenge', 'Test your Skills: Python', 'Poll', 'Where to go from here?', 'Plan for February 2022', '1.5 Types of Databases', '1.6\tHow data is Stored in Relational Databases', '1.7\tHow data is stored in NoSQL databases', 'Exercise 1', 'Course Handouts', '2.1\tIntroduction', '2.2\tArchitecture: Client and Server', '2.3\tMySQL Distributions', '2.4\tLocal Installation on Mac', '2.5\tLocal Installation on Linux', '2.6\tLocal Installation on Windows', '2.7\tLicensing', '2.8\tAccessing a remote MySQL server', '2.9\tGraphical user interfaces', 'Exercise 2', 'SQL - Installation Guide', '3.1\tIntroduction', '3.2\tWhat exactly is SQL?', '3.3\tHistory of SQL', '3.4\tConnecting to MySQL', '3.5\tTypes of Commands - DDL (Creation/ Deletion/ Updating of Schema', '3.6\tTypes of Commands - DML (Manipulating data in tables)', '3.7\tTypes of Commands - DCL (Managing Access control)', '3.8\tExploring databases', '3.9\tCreating tables', '3.10 Inserting data in tables', '3.11 SELECT Statement - Introduction', '3.12 Datatypes in MySQL', '3.13 NULL vs NOT NULL', 'Exercise 3', '4.1\tIntroduction', '4.2\tUpdate command – Concept', '4.3\tUpdate command – Example', '4.4\tDelete command – Concept', '4.5\tDelete command – Example', '4.6\tDescribe command – Concept', '4.7\tDescribe command – Example', '4.8\tAlter command – Concept and Example', 'Copy of Exercise 4', '5.1\tIntroduction', '5.2\tImporting data from CSV to MySQL', '5.3\tExporting data from MySQL to CSV', '5.4\tBacking up databases', '5.5\tRestoring databases', 'Exercise 5', 'Importing and Exporting Datasets - Troubleshooting Guide', '6.1\tIntroduction', '6.2\tCounting Rows and Items', '6.3\tAggregation Functions – SUM, AVG, STDDEV', '6.4\tExtreme Values Identification – MIN, MAX', '6.5\tSlicing data', '6.6\tLimiting data', '6.7\tSorting data', '6.8\tFiltering Patterns', '6.9\tGroupings, Rolling up data and Filtering in Groups', 'Exercise 6', '7.1\tIntroduction', '7.2\tData Eyeballing', '7.3\tData Dictionary', '7.4\tQuestions we need answers of', '7.5\tAnalyzing data and creating table structure', '7.6\t Loading data to our MySQL table', '7.7\tData Analysis – Simple Queries', '7.8\tData Analysis – Advanced Queries', 'FIFA19 Players dataset (cleaned) for this Project', '8.1 Introduction', '8.2.\tThe need for joins', '8.3.\tDifferent type of joins', '8.4.\tThe Left Join - Concept', '8.5.\tThe Left Join – Practical Example', '8.6.\tThe Inner Join', '8.7.\tThe Cross Join', '8.8.\tThe Right Join', '8.9.\tThe Self Join', 'Assignment: Share your learning and build your profile', 'Exercise', '9.1.\t Introduction', '9.2.\t Introduction to Indexing', '9.3.\tHow indexing works (basics)', '9.4.\tRelationships', '9.5.\tTypes of Relationships', '9.6.\tTable Constraints – PRIMARY KEY, FOREIGN KEY, UNIQUENESS and AUTO INCREMENT', 'Exercise', '10.1 String functions - CONCAT', '10.2 String functions – Case Conversion', '10.3 String functions – Trimming Strings', '10.4 String functions – Extracting Substrings', '10.5 Date/ Time functions – Current date and time', '10.6 Date/ Time functions – Extracting date and time from field', '10.7 Date/ Time functions – Formatting date and time as Strings', '10.8 Numeric functions', 'SQL CheatSheet', 'Exercise', '11.1 Introduction', '11.2 Setting up a virtual environment', '11.3 Installing the required packages', '11.4 Connecting to MySQL', '11.5 Connecting to database table and pulling data', '11.6 Querying the database- INSERT', '11.7 Querying the database- DELETE', '11.8 Querying the database- SEARCH', '11.9 Querying the database- INDEXING', '11.10 Notes and Resources', 'Exercise', 'Basic Linux Commands', 'Introduction to Cloud Computing', 'Cloud Deployment Models', 'Service Models', 'Resources: Learn about AWS', 'Creating Databases and Collections', 'Inserting Documents', 'Reading Documents', 'The _id Field', 'Importing and Exporting Data', 'Backup and Restore MongoDB Databases', 'Updating Documents', 'Deleting Documents, Collections and Databases', 'CRUD Operations in MongoDB Atlas', 'Importing, Exporting and Working with MongoDB Atlas', 'What is Big Data?', 'Challenges with Big Data', 'Applications of Big Data', 'Distributed Systems', 'What is Hive', 'Features of Hive', 'Working of Hive']"
Writing Powerful Data Science Articles,/courses/writing-powerful-data-science-articles,"""Either write something worth reading or do something worth writing."" - Benjamin Franklin
The best way to learn any concept, especially in data science, is by writing about it. That not only helps you understand what you learned in more detail, but sharing it with the community helps others understand how a particular data science idea works.
But here’s the thing - most people want to write, but just can’t get past the initial challenges. This might sound familiar to a lot of people:

What should I write about?
Will anyone read my article?
How do I make my article stand out?
Should I even write?


If you’ve ever asked yourself these questions, you’ll find the answers in this free crash course on how to write impactful and awesome data science articles!","['Why did we create this course?', 'AI&ML Blackbelt Plus Program (Sponsored)', 'Session #1 - How to Write Powerful and Impactful Data Science Articles', ""Session #2 - Writing Data Science Articles that Grab your Reader's Attention"", 'Expert Talk: Parul Pandey on Writing Powerful Data Science Articles', ""Congrats! Here's what's next""]"
