Course_Name,Course_Link,Course_Description,Course_Curriculum
"Gemini: Google's AI That Reads , Sees, Hears and Understands",/courses/gemini-googles-ai-that-reads-sees-hears-and-understands,"Develop higher-order skills in creating a Gemini-inspired multimodal AI system through this comprehensive guide. Apply foundational neural architecture concepts, analyze multimodal integration strategies, and evaluate efficient training methods. Guided by structured tutorials, synthesize your knowledge to design, implement, and assess advanced AI systems capable of reasoning across diverse modalities for real-world innovations.","['Introduction', 'Intro to Gemini models', 'Function Calling with Gemini', 'Why Gen-AI', 'Are LLMs Really Intelligent', 'LLMs at Google- A brief history', 'Q&A Session']"
Reimagining GenAI: Common Mistakes and Best Practices for Success,/courses/reimagining-genai-common-mistakes-and-best-practices-for-success,"Generative AI is transforming industries, but implementation challenges often hinder its success. This course, led by experienced GenAI expert Shabazz Mohammed, dives deep into the pitfalls of adopting generative AI and provides actionable best practices to overcome them.
Learn from real-world scenarios, understand why hi-fi demos fail in production, and gain insights into scalable, ethical, and ROI-driven AI adoption.","['Introduction', 'State of GenAI in 2024', 'Common Mistakes', 'Best Practices for Success', 'Demo- GenAI Chatbot Alignment', 'Case Study- Top US Bank Co-pilot on CLO Documents']"
Coding a ChatGPT-style Language Model from Scratch in PyTorch,/courses/coding-a-chatgpt-style-language-model-from-scratch-in-pytorch,"Master the art of building a ChatGPT-style language model from scratch with PyTorch. In this course, you'll explore essential NLP concepts, implement transformers, and create a decoder-only architecture step-by-step. Guided by expert tutorials, gain practical skills to develop advanced AI models tailored for real-world applications.","['Introduction', 'Importing', 'Creating Inputs & Lables', 'Position Encoding', 'Masked Self-Attention', 'Putting Pieces Together', 'Creating Decoder Only Transformer']"
Mastering Multilingual GenAI Open-Weights for Indic Languages,/courses/mastering-multilingual-genai-open-weights-for-indic-languages,"Mastering Multilingual GenAI – Open-Weights for Indic Languages"" is a course designed to equip you with the knowledge to develop state-of-the-art multilingual AI models using open-weight architectures. Focusing on low-resource languages, particularly Indic languages, the course covers essential topics like multilingual AI training, instruction fine-tuning, model building, and performance evaluation.","['Introduction', 'Importance of Multilingual', 'Training for Multilingual Gen AI', 'Instruction Fine-Tuning Data for Multilingual', 'Measuring Performance for Multilingual', 'Building a Model', 'Human Preferences', 'Curse of Multilinguality', 'Coding Hands-On']"
Learning Autonomous Driving Behaviors with LLMs & RL,/courses/learning-autonomous-driving-behaviors-with-llms-and-rl,"This course dives into the development of autonomous driving behaviors using Reinforcement Learning (RL) and Large Language Models (LLMs). You’ll explore how RL agents are trained to navigate complex, real-world environments while making safe, human-like driving decisions. The course tackles key challenges such as designing effective reward systems, ensuring safety in high-speed driving scenarios, and improving the interpretability of AI decisions. Through practical projects, you will design RL agents using techniques like Deep Q-Networks (DQN), experience replay, and integrate LLMs to enhance decision-making.","['Introduction', 'Evolution RL', 'Understanding RL', 'Challenges with RL', 'Approach to the Problem Statement', 'Hands-On: Learning Autonomous Driving Behaviors with LLMs & RL']"
GenAI Applied to Quantitative Finance: For Control Implementation,/courses/genai-applied-to-quantitative-finance-for-control-implementation,"This course explores the application of Generative AI in quantitative finance, focusing on building sustainable trading algorithms through keyword extraction, sentiment analysis, and time-series forecasting. Learn to predict commodity prices, such as gold, by integrating data from financial news sources, leveraging sentiment analysis, and optimizing models for robust trading signals.","['Introduction', 'Overview', 'Problem Definition: Commodity Price Prediction', 'Architecture', 'Hands-On']"
"Navigating LLM Tradeoffs: Techniques for Speed, Cost, Scale & Accuracy",/courses/navigating-llm-tradeoffs-techniques-for-speed-cost-scale-and-accuracy,"This course provides a concise guide to optimizing Large Language Models (LLMs) by navigating tradeoffs in speed, cost, scale, and accuracy. Learn practical techniques like LoRA, model quantization, and parameter-efficient fine-tuning to improve performance while reducing costs. You'll explore various deployment strategies and understand how to evaluate LLMs using industry-standard benchmarks, making this course ideal for anyone seeking efficient, scalable AI solutions.","['Introduction', 'Resources', 'Technique to Increase Accuracy', 'Training Speed and Cost Optimization', 'Inference Speed and Cost Optimization', 'Scale']"
Creating Problem-Solving Agents using GenAI for Action Composition,/courses/creating-problem-solving-agents-using-genai-for-action-composition,"This introductory course provides a concise overview of Agentic AI systems, covering their evolution, current state, and practical applications. You will explore key topics including the history of Agentic AI systems, the role of agents today, multi-agent systems, and practical solutions for implementing them. Perfect for those seeking a foundational understanding of intelligent Agentic AI systems in action.","['Introduction', 'Overview- Count the Number of Agents', 'A brief history of Agentic Systems', 'Agents Today', 'Multi-Agent Systems Today', 'Practical Solutions']"
Improving Real World RAG Systems: Key Challenges & Practical Solutions,/courses/improving-real-world-rag-systems-key-challenges,"This course explores the key challenges in building real-world Retrieval-Augmented Generation (RAG) systems and provides practical solutions. Topics include improving data retrieval, dealing with hallucinations, context selection, and optimizing system performance using advanced prompting, retrieval strategies, and evaluation techniques. Through hands-on demos, you will gain insights into better chunking, embedding models, and agentic RAG systems for more robust, real-world applications.","['Introduction to RAG Systems', 'Resources', 'RAG System Challenges Practical Solutions', 'Hands-on: Solution for Missing Content in RAG', 'Other Key Challenges', 'Practical Solutions', 'Hands-on: Solution for Missed Top Ranked, Not in Context, Not Extracted _ Incorrect SpecificityHands-on- Solution for Missed', 'Wrong Format Problem  Solution', 'Hands-on: Solution for Wrong Format', 'Incomplete Problem Solution', 'HyDE', 'Other Practical Solutions from recent Research Papers']"
Framework to Choose the Right LLM for your Business,/courses/choosing-the-right-LLM-for-your-business,"This course will guide you through the process of selecting the most suitable Large Language Model (LLM) for various business needs. By examining factors such as accuracy, cost, scalability, and integration, you will understand how different LLMs perform in specific scenarios, from customer support to healthcare and strategy development. The course emphasizes practical decision-making with real-world case studies, helping businesses navigate the rapidly evolving LLM landscape effectively.","['Introduction', ""It's an LLM World!"", 'Understand Your Business', 'Framework to Choose the Right LLM', 'Case Studies', 'Conclusion']"
Building Smarter LLMs with Mamba and State Space Model,/courses/building-smarter-llms-with-mamba-and-state-space-model,"Unlock the Power of State Space Models (SSM) like Mamba with our comprehensive course designed for AI professionals, data scientists, and NLP enthusiasts. Master the art of integrating SSM with deep learning, unravel the complexities of models like Mamba, and elevate your understanding of Generative AI's newest and most innovative models. This course is designed to equip you with the skills needed to understand these cutting-edge AI models and how they work, making you proficient in the latest AI techniques and architectures.","['Course Overview', 'Are RNNs a Solution', 'The Problem with Transformers', 'What is a State Space Model?', 'The Discrete Representation', 'The Recurrent Representation', 'The Convolution Representation', 'The Three Representations', 'The Importance of the A Matrix', 'What Problem does it attempt to Solve?', 'Selectively Retaining Information', 'Speeding Up Computations', 'Exploring the Mamba Block', 'Jamba - Mixing Mamba with Transformers']"
Generative AI - A Way of Life - Free Course,/courses/genai-a-way-of-life,"This course is a transformative journey tailored for beginners and delves into AI-powered text and image generation using leading tools like ChatGPT, Microsoft Copilot, and DALL·E3. Learn practical applications across industries, ethical considerations, and best practices. Whether you're a content creator, business innovator, or AI enthusiast, gain the expertise to harness Generative AI's full potential and drive innovation in your field.","['Fundamentals of Generative AI', 'What is Generative AI?', 'How does Generative AI work?', 'Exploring the Potential of Generative AI', 'GenAI Pinnacle Program', 'Hands On: Let’s get generating!', 'An Overview of Text Generation', 'What is ChatGPT?', 'Working with ChatGPT', 'Working with ChatGPT Plus', 'Build a Custom GPT', 'Working with Microsoft Copilot', 'Working with Google Gemini', 'Gen AI Pinnacle Ad', 'Learning the Art of Prompting', 'Creating a Chatbot', 'Ethics and Best Practices', 'Introduction to Image Generation', 'Exploring the Potential of Image Generation', 'Working with free image generation tools', 'Working with Clipdrop', 'Working with Bing Image Creator', 'Working with Firefly', 'Working with Paid Image Generative Tools', 'Working with paid image generative tools DreamStudio', 'Working with DALLE-2', 'Working with Midjourney', 'Gen AI Pinnacle Ad', 'Prompting your Way to Art', 'Accomplishing Tasks with Image Generation', 'E for Ethics and Efficiency']"
Building LLM Applications using Prompt Engineering - Free Course,/courses/building-llm-applications-using-prompt-engineering-free,"This course will provide you with a hands-on understanding of building LLM applications and mastering prompt engineering techniques. By the end of the course, you will be proficient in implementing and fine-tuning these techniques to enhance generative AI model performance. You'll learn to apply various prompting methods and build chatbots on enterprise data, equipping you with the skills to improve conversational AI systems in real-world projects.
Who Should Enroll:

Professionals: Individuals looking to deepen their knowledge and apply advanced LLM and prompt engineering techniques to solve complex problems across various domains.
Aspiring Students: Individuals looking to deepen their knowledge and apply advanced LLM and prompt engineering techniques to solve complex problems across various domains.","['Introduction to Building Different LLM applications', 'Prompt Engineering', 'Retrieval Augmented Generation', 'Finetuning LLMs', 'Training LLMs from Scratch', 'Quiz', 'Course handouts', 'Introduction to Prompt Engineering', 'Set up your machine for Prompt Engineering', 'Prompt Engineering with ChatGPT API', 'Enabling Conversation with ChatGPT API', 'Quiz', 'Introduction to Understanding Different Prompt Engineering Techniques', 'Few Shot Prompting', 'One Shot Prompting', 'Zero Shot Prompting', 'Quiz', 'Assignment']"
Building Your First Computer Vision Model - Free Course,/courses/building-your-first-computer-vision-model,"This course will help you gain a deep understanding of Computer Vision and build advanced CV models using the PyTorch framework. With a carefully curated list of resources and exercises, this course is your guide to becoming a Computer Vision expert. Master the techniques to build convolutional neural networks, and classify images.
Who Should Enroll:

Professionals: Individuals looking to expand their skill set and leverage CV across different industries.
Aspiring Students: For those setting out on their journey to master image data analysis and leave a mark in the tech world.","['Pixel Perfect - Decoding Images', 'Understanding a CNN - Convolutional Layer', 'Hands on - Image Processing Techniques', 'Understanding a CNN - Striding and Pooling', 'Understanding a CNN - Pooling Layer', 'Understanding AlexNet and Building a CNN Model', 'Quiz']"
Bagging and Boosting ML Algorithms - Free Course,/courses/bagging-boosting-ML-Algorithms,"This course will provide you with a hands-on understanding of Bagging and Boosting techniques in machine learning. By the end of the course, you will be proficient in implementing and tuning these ensemble methods to enhance model performance. You'll learn to apply algorithms like Random Forest, AdaBoost, and Gradient Boosting to a real-world dataset, equipping you with the skills to improve predictive accuracy and robustness in your projects.

Who Should Enroll:

Professionals: Individuals looking to deepen their knowledge and apply advanced machine learning techniques like Bagging and Boosting to solve complex problems across various domains
Aspiring Students: Individuals looking to deepen their knowledge and apply advanced ML techniques to bring value to businesses","['Resources to be used in this course', 'Problem Statement', 'Understanding Ensemble Learning', 'Introducing Bagging Algorithms', 'Hands-on to Bagging Meta Estimator', 'Introduction to Random Forest', 'Understanding Out-Of-Bag Score', 'Random Forest VS Classical Bagging VS Decision Tree', 'Project', 'Introduction to Boosting', 'AdaBoost Step-by-Step Explanation', 'Hands-on - AdaBoost', 'Gradient Boosting Machines (GBM)', 'Hands-on Gradient Boost', 'Other Algo (XGBoost, LightBoost. CatBoost)', 'Project: Anova Insurance']"
MidJourney: From Inspiration to Implementation - Free Course,/courses/midjourney_from_inspiration_to_implementation,"This course will provide you with a practical understanding of MidJourney tools. By the end of the course, you will be able to utilize MidJourney effectively and explore alternative tools for your creative projects. You'll learn how to draw inspiration, use MidJourney's features, and understand its applications through engaging lessons.

Who Should Enroll:

Creative Professionals: Individuals looking to enhance their creativity and apply MidJourney tools to various artistic and visual projects.
Aspiring Creatives: Those beginning their journey into visual storytelling and digital art, seeking to learn the fundamentals of MidJourney and its alternatives.","['MidJourney - Storm _ Story', 'MidJourney - Inspiration', 'MidJourney - How to use', 'MidJourney  Alternatives', 'Quiz']"
Understanding Linear Regression - Free Course,/courses/free-understanding-linear-regression,"This free course will help you understand the fundamentals of linear regression in a straightforward manner. By the end of this course, you will be able to build predictive models using linear regression techniques. With a carefully curated list of resources and exercises, this course serves as your comprehensive guide to mastering linear regression.","['Introduction to the Problem Statement', 'Resources for this Course', 'Introduction to Linear Regression', 'Significance of Slope and Intercept in the linear regression', 'How Model Decides The Best-Fit Line', 'Let’s Build a Simple Linear Regression Model', 'Model Understanding Using Descriptive Approach', 'Model Understanding Using Descriptive Approach - II', 'Model Building Using Predictive Approach', 'Quiz: Linear regression']"
The Working of Neural Networks - Free Course,/courses/the-working-of-neural-networks,"This free course will help you understand the end-to-end working of neural networks in a simple manner. By the end of this course, you will be able to build advanced Deep Learning models using the PyTorch framework. With a carefully curated list of resources and exercises, this course serves as your comprehensive guide to mastering deep learning. It is recommended that you complete the advanced Machine Learning course before taking up this course.","['How are Neural Networks trained - Forward Propagation', 'Understanding Loss Functions + Hands on', 'Reading: Creating a Custom Loss Function (Optional)', 'Optimization Techniques - Gradient Descent', 'What is Back Propagation?', 'Types of Gradient Descent', 'Common Optimization Techniques - Part 1', 'Common Optimization Techniques - Part 2', 'Building a Deep Neural Network (Hands-on Regression Model)', 'Building a Deep Neural Network (Hands-on Classification Model)', 'Quiz']"
The A to Z of Unsupervised ML - Free Course,/courses/free-unsupervised-ml-guide,"Unsupervised machine learning helps uncover hidden patterns and structures in data without labeled examples. It is essential for exploratory data analysis, reducing dimensionality, and discovering intrinsic relationships within datasets. Mastering unsupervised techniques enhances data preprocessing and drives insights in complex datasets where labels are scarce or unavailable.","['Resources to be used in this course.', 'Setting the Context', 'Choosing Clustering Algorithms', 'Solving our Problem using k-means - Part 1', 'Solving our Problem using k-means - Part 2', 'Finding optimal K value', 'Analysis and Insights Based on the Plots', 'Introduction to Hierarchical Clustering Analysis (HCA)', 'Solving our Problem using Hierarchical Clustering', 'Introduction to DBSCAN Clustering', 'Solving our Problem using DBSCAN', 'Reading: Applications of Clustering in the Real World', 'Project']"
Building Your first RAG System using LlamaIndex - Free Course,/courses/building-first-rag-systems-using-llamaindex,"This course will guide you through building your first Retrieval-Augmented Generation (RAG) system using LlamaIndex. You will start with data ingestion by loading a file into the system, followed by indexing the data for efficient retrieval. Next, you will set up retrieval configurations and use a response synthesizer to combine data into a coherent response. Finally, you will employ a query engine to generate responses. By the end of this course, you will have a solid understanding of these processes and be able to build an RAG system using LlamaIndex code effectively.","['Welcome to this course', 'Why RAG', 'What is RAG system', 'Overview of RAG Framework', 'Quiz', 'Course handouts', 'Introduction to LlamaIndex', 'Components of LlamaIndex', 'Reading Material: How to get your API Key', 'How to get Open AI Keys - 2 min - Website go through', 'Build Your First RAG system using LlamaIndex', 'Quiz']"
Data Preprocessing on a Real-World Problem Statement - Free Course,/courses/data-preprocessing,"This course will help you get a practical understanding of Data Preprocessing. After this course, you can work on any data and prepare it for modelling. With a carefully curated list of resources, this course is your first step to becoming a Data Scientist. By the end of the course, you will have mastered techniques like EDA and Missing Value Treatment.
Who Should Enroll:

Professionals: Individuals looking to expand their skill set on data cleaning and preparation.
Aspiring Students: For those setting out on their journey to become a data scientist and making a mark in the tech world.","['Resources to be used in this course', 'Introduction to Problem Statement', 'Reading Material - Understanding the Data', 'ML-workflow', 'Tasks to be Performed', 'Combining Product Attribute Data with POS Data', 'Combining all the tables in the Dataframe', 'Understanding the Combined Data', 'Treating Missing Values - Part 1', 'Treating Missing Values Part - 2', 'Outlier Detection and Treatment', 'Preparing the Dataset for Supervised and Unsupervised Models', 'Generative AI for Data Analysis']"
Exploring Stability.AI - Free Course,/courses/exploring-stability-ai,"This course will give you a practical understanding of Stability.AI tools. By the end of the course, you will be able to deploy and customize SD WebUI, and use the Automatic1111 WebUI on RunPod GPU environments. You'll learn to install, set up, generate, and fine-tune SD WebUI settings, equipping you with the skills to harness Stability.AI's full potential for your projects.

Who Should Enroll:

Professionals: Individuals aiming to enhance their skill set and apply Stability.AI tools/Stable Diffusion in various fields.
Aspiring Students: Those beginning their journey to mastering Generative AI tool deployment and customization, looking to make an impact in the evolving world of Generative AI","['Introduction to Stability', 'How to use Stability.AI tools', 'Review of Deployment Options for SD WebUI', 'Automatic1111 WebUI on RunPod GPU environment', 'SD WebUI Hands-On - Installation and Setup', 'SD WebUI Hands-On - Generation and Settings', 'Quiz']"
Building a Text Classification Model with Natural Language Processing - Free Course,/courses/free-building-textclassification-natural-language-processing,"Gain practical insights into Natural Language Processing (NLP) with our comprehensive course. Learn to build NLP models using PyTorch, delve into classification models, and apply techniques like bag-of-words, count vectorizer and so on. Perfect for professionals seeking to enhance their skills and aspiring students entering the tech industry.
Who Should Enroll:

Professionals: Expand your skill set with NLP for real-world applications in diverse industries. 
Aspiring Students: Master text data analysis and kickstart your career in AI and NLP.","['What is NLP', 'Common tasks in a NLP Project', 'NLP Libraries', 'Resources for the Course', 'Methods of Text Preprocessing - Part 1', 'Methods of Text Preprocessing - Part 2', 'Methods of Text Preprocessing - Part 3', 'Quiz', 'Introduction to dataset and problem statement', 'Creating a Basic Review Classification Model', 'Understanding TF-IDF and its implementations', 'Understanding N-grams', 'Advanced Preprocessing Techniques', 'Building an basic ANN model', 'Limitations of ANN', 'Quiz']"
Getting Started with Large Language Models,/courses/getting-started-with-llms,"This course will help you gain a comprehensive understanding of Large Language Models (LLMs) and develop advanced natural language processing (NLP) applications using the PyTorch framework. With a carefully curated list of resources and exercises, this course is your guide to becoming an expert in LLMs. Master the techniques to build and fine-tune LLMs, and generate human-like text.
Who Should Enroll: Professionals: Individuals looking to expand their skill set and leverage LLMs across different industries. Aspiring Students: For those setting out on their journey to master language data analysis and leave a mark in the tech world.","['Course Objective', 'Course Handouts', 'The Exponential Growth', 'The Evolution of NLP: Symbolic NLP', 'The Evolution of NLP: Statistical NLP', 'The Evolution of NLP: Deep Learning', 'The Evolution of NLP: Deep Learning Era II', 'The Evolution of NLP: Tranformers and Evolution', 'Quiz', 'Introduction to Large Language Model', 'What is a Large Language Model?', 'Understanding Foundational Models', 'Different types of LLMs: Based on Response', 'Different types of LLMs: Based on Model Architecture', 'Quiz', 'The Current State of the Art in LLMs', 'Generative AI- Glossary', 'Your Feedback Matters!']"
Introduction to Generative  AI,/courses/introduction-to-generative-ai,"This course will provide you with a comprehensive understanding of generative AI, including text and image generation techniques. By the end of the course, you will be have an understanding of using generative AI tools to create diverse content. You'll learn how generative AI works, engage in practical exercises, and gain the skills to implement these techniques in real-world projects.
Who Should Enroll:


Professionals: Individuals looking to enhance their skills in generative AI and apply advanced techniques to create innovative solutions across various domains.

Aspiring Students: Individuals eager to enter the field of generative AI and apply generative AI techniques to tackle complex problems and generate creative content across different fields.","['What is Generative AI', 'How does Gen AI work', 'Quiz', 'Text Generation with Gen AI', 'Image Generation with Gen AI', 'Quiz', 'Meet your Instructors', 'Course Handout', 'Your Feedback Matters!']"
